{
  "id": "HT_palpitations",
  "complaint_code": "CC_palpitations",
  "name": "Palpitations history",
  "synonyms": [
    "Palpitations",
    "Racing heart",
    "Fluttering heart",
    "Pounding heartbeat",
    "Skipped beats"
  ],
  "body_system": "cardiovascular",
  "source": {
    "work": "Bates' Guide to Physical Examination and History Taking",
    "note": "Structure for history-taking only; not for disease extraction."
  },
  "red_flag_question_ids": [
    "Q000153",
    "Q000036",
    "Q000037"
  ],
  "sections": [
    {
      "key": "hpi_core",
      "title": "HPI — core characteristics",
      "question_ids": [
        "Q000001",
        "Q000002",
        "Q000003",
        "Q000004",
        "Q000005",
        "Q000006",
        "Q000007",
        "Q000008",
        "Q000009",
        "Q000010",
        "Q000152"
      ]
    },
    {
      "key": "associated",
      "title": "Associated symptoms",
      "question_ids": [
        "Q000036",
        "Q000037",
        "Q000038",
        "Q000173"
      ]
    },
    {
      "key": "red_flags",
      "title": "Alarm / red flags",
      "question_ids": [
        "Q000153",
        "Q000069",
        "Q000037"
      ]
    },
    {
      "key": "risk_context",
      "title": "Risk factors & exposures",
      "question_ids": []
    },
    {
      "key": "background",
      "title": "PMH / PSH / meds / allergies / FH / SH",
      "question_ids": [
        "Q000078",
        "Q000079",
        "Q000080",
        "Q000081",
        "Q000082",
        "Q000083",
        "Q000084",
        "Q000085",
        "Q000086",
        "Q000087",
        "Q000088",
        "Q000089",
        "Q000090"
      ]
    }
  ],
  "associated_complaint_codes": [
    "CC_chest_pain",
    "CC_syncope",
    "CC_dyspnea"
  ],
  "schema_version": 1,
  "revision": 1,
  "status": "active"
}
