{
  "id": "HT_anal_pain",
  "complaint_code": "CC_anal_pain",
  "name": "Anal / perianal symptom history",
  "synonyms": [
    "Anal pain",
    "Anal itching",
    "Perianal swelling",
    "Rectal discharge",
    "Painful defecation",
    "Rectal prolapse sensation"
  ],
  "body_system": "abdomen",
  "source": {
    "work": "Bates' Guide to Physical Examination and History Taking",
    "note": "Structure for history-taking only; not for disease extraction."
  },
  "red_flag_question_ids": [
    "Q000035",
    "Q000019",
    "Q000038"
  ],
  "sections": [
    {
      "key": "hpi_core",
      "title": "HPI — core characteristics",
      "question_ids": [
        "Q000001",
        "Q000002",
        "Q000003",
        "Q000004",
        "Q000005",
        "Q000006",
        "Q000007",
        "Q000008",
        "Q000009",
        "Q000010",
        "Q000137",
        "Q000131",
        "Q000138",
        "Q000139",
        "Q000140"
      ]
    },
    {
      "key": "associated",
      "title": "Associated symptoms",
      "question_ids": [
        "Q000035",
        "Q000024",
        "Q000023",
        "Q000134",
        "Q000130"
      ]
    },
    {
      "key": "red_flags",
      "title": "Alarm / red flags",
      "question_ids": [
        "Q000035",
        "Q000019",
        "Q000038",
        "Q000075"
      ]
    },
    {
      "key": "risk_context",
      "title": "Risk factors & exposures",
      "question_ids": []
    },
    {
      "key": "background",
      "title": "PMH / PSH / meds / allergies / FH / SH",
      "question_ids": [
        "Q000078",
        "Q000079",
        "Q000080",
        "Q000081",
        "Q000082",
        "Q000083",
        "Q000084",
        "Q000085",
        "Q000086",
        "Q000087",
        "Q000088",
        "Q000089",
        "Q000090"
      ]
    }
  ],
  "associated_complaint_codes": [
    "CC_hematochezia",
    "CC_constipation",
    "CC_diarrhea"
  ],
  "schema_version": 1,
  "revision": 1,
  "status": "active"
}
