{
  "id": "HT_dyspnea",
  "complaint_code": "CC_dyspnea",
  "name": "Dyspnea / shortness of breath history",
  "synonyms": [
    "Shortness of breath",
    "Breathlessness",
    "Orthopnea",
    "Paroxysmal nocturnal dyspnea",
    "PND",
    "Difficulty breathing"
  ],
  "body_system": "respiratory",
  "source": {
    "work": "Bates' Guide to Physical Examination and History Taking",
    "note": "Structure for history-taking only; not for disease extraction."
  },
  "red_flag_question_ids": [
    "Q000036",
    "Q000038",
    "Q000074"
  ],
  "sections": [
    {
      "key": "hpi_core",
      "title": "HPI — core characteristics",
      "question_ids": [
        "Q000001",
        "Q000002",
        "Q000003",
        "Q000004",
        "Q000005",
        "Q000006",
        "Q000007",
        "Q000008",
        "Q000009",
        "Q000010",
        "Q000011",
        "Q000012",
        "Q000013",
        "Q000014",
        "Q000015",
        "Q000016",
        "Q000070",
        "Q000071",
        "Q000144",
        "Q000145"
      ]
    },
    {
      "key": "associated",
      "title": "Associated symptoms",
      "question_ids": [
        "Q000036",
        "Q000039",
        "Q000017",
        "Q000072",
        "Q000038",
        "Q000147",
        "Q000149",
        "Q000146",
        "Q000156",
        "Q000157"
      ]
    },
    {
      "key": "red_flags",
      "title": "Alarm / red flags",
      "question_ids": [
        "Q000036",
        "Q000038",
        "Q000074",
        "Q000073"
      ]
    },
    {
      "key": "background",
      "title": "PMH / PSH / meds / allergies / FH / SH",
      "question_ids": [
        "Q000078",
        "Q000079",
        "Q000080",
        "Q000081",
        "Q000082",
        "Q000083",
        "Q000084",
        "Q000085",
        "Q000086",
        "Q000087",
        "Q000088",
        "Q000089",
        "Q000090"
      ]
    }
  ],
  "associated_complaint_codes": [
    "CC_chest_pain",
    "CC_cough",
    "CC_fever"
  ],
  "schema_version": 1,
  "revision": 3,
  "status": "active"
}
