{
  "id": "HT_food_intolerance",
  "complaint_code": "CC_food_intolerance",
  "name": "Food-triggered symptom history",
  "synonyms": [
    "Food intolerance",
    "Food-related symptoms",
    "Meal-triggered symptoms",
    "Lactose-type intolerance (patient language)"
  ],
  "body_system": "abdomen",
  "source": {
    "work": "Bates' Guide to Physical Examination and History Taking",
    "note": "Structure for history-taking only; not for disease extraction."
  },
  "red_flag_question_ids": [
    "Q000019",
    "Q000035",
    "Q000033"
  ],
  "sections": [
    {
      "key": "hpi_core",
      "title": "HPI — core characteristics",
      "question_ids": [
        "Q000001",
        "Q000002",
        "Q000003",
        "Q000004",
        "Q000005",
        "Q000006",
        "Q000007",
        "Q000008",
        "Q000142",
        "Q000005",
        "Q000006",
        "Q000007"
      ]
    },
    {
      "key": "associated",
      "title": "Associated symptoms",
      "question_ids": [
        "Q000023",
        "Q000025",
        "Q000126",
        "Q000127",
        "Q000021",
        "Q000042",
        "Q000129"
      ]
    },
    {
      "key": "red_flags",
      "title": "Alarm / red flags",
      "question_ids": [
        "Q000019",
        "Q000035",
        "Q000034",
        "Q000033"
      ]
    },
    {
      "key": "risk_context",
      "title": "Risk factors & exposures",
      "question_ids": [
        "Q000053"
      ]
    },
    {
      "key": "background",
      "title": "PMH / PSH / meds / allergies / FH / SH",
      "question_ids": [
        "Q000078",
        "Q000079",
        "Q000080",
        "Q000081",
        "Q000082",
        "Q000083",
        "Q000084",
        "Q000085",
        "Q000086",
        "Q000087",
        "Q000088",
        "Q000089",
        "Q000090"
      ]
    }
  ],
  "associated_complaint_codes": [
    "CC_diarrhea",
    "CC_abdominal_pain",
    "CC_abdominal_distention",
    "CC_heartburn"
  ],
  "schema_version": 1,
  "revision": 1,
  "status": "active"
}
