{
  "id": "HT_headache",
  "complaint_code": "CC_headache",
  "name": "Headache history",
  "synonyms": [
    "Headache",
    "Cephalgia",
    "Head pain",
    "Migraine-type headache (patient language)"
  ],
  "body_system": "neurologic",
  "source": {
    "work": "Bates' Guide to Physical Examination and History Taking",
    "note": "Structure for history-taking only; not for disease extraction."
  },
  "red_flag_question_ids": [
    "Q000175",
    "Q000176",
    "Q000017"
  ],
  "sections": [
    {
      "key": "hpi_core",
      "title": "HPI — core characteristics",
      "question_ids": [
        "Q000001",
        "Q000002",
        "Q000003",
        "Q000004",
        "Q000005",
        "Q000006",
        "Q000007",
        "Q000008",
        "Q000009",
        "Q000010",
        "Q000011",
        "Q000012",
        "Q000013",
        "Q000014",
        "Q000015",
        "Q000016",
        "Q000040",
        "Q000174",
        "Q000175"
      ]
    },
    {
      "key": "associated",
      "title": "Associated symptoms",
      "question_ids": [
        "Q000021",
        "Q000017",
        "Q000018",
        "Q000037",
        "Q000182",
        "Q000022",
        "Q000181"
      ]
    },
    {
      "key": "red_flags",
      "title": "Alarm / red flags",
      "question_ids": [
        "Q000175",
        "Q000176",
        "Q000069"
      ]
    },
    {
      "key": "risk_context",
      "title": "Risk factors & exposures",
      "question_ids": []
    },
    {
      "key": "background",
      "title": "PMH / PSH / meds / allergies / FH / SH",
      "question_ids": [
        "Q000078",
        "Q000079",
        "Q000080",
        "Q000081",
        "Q000082",
        "Q000083",
        "Q000084",
        "Q000085",
        "Q000086",
        "Q000087",
        "Q000088",
        "Q000089",
        "Q000090"
      ]
    }
  ],
  "associated_complaint_codes": [
    "CC_fever",
    "CC_dizziness",
    "CC_vomiting"
  ],
  "schema_version": 1,
  "revision": 2,
  "status": "active"
}
