{
  "id": "HT_heartburn",
  "complaint_code": "CC_heartburn",
  "name": "Heartburn history",
  "synonyms": [
    "Pyrosis",
    "Acid regurgitation",
    "Sour taste in mouth",
    "Rising burning behind the breastbone"
  ],
  "body_system": "esophagus",
  "source": {
    "work": "Bates' Guide to Physical Examination and History Taking",
    "note": "Structure for history-taking only; not for disease extraction."
  },
  "red_flag_question_ids": [
    "Q000031",
    "Q000019",
    "Q000033",
    "Q000034",
    "Q000077"
  ],
  "sections": [
    {
      "key": "hpi_core",
      "title": "HPI — core characteristics",
      "question_ids": [
        "Q000001",
        "Q000002",
        "Q000003",
        "Q000004",
        "Q000005",
        "Q000006",
        "Q000007",
        "Q000008",
        "Q000009",
        "Q000010",
        "Q000011",
        "Q000012",
        "Q000013",
        "Q000014",
        "Q000015",
        "Q000016",
        "Q000059",
        "Q000060",
        "Q000061",
        "Q000143"
      ]
    },
    {
      "key": "associated",
      "title": "Associated symptoms",
      "question_ids": [
        "Q000057",
        "Q000031",
        "Q000032",
        "Q000036",
        "Q000039",
        "Q000021",
        "Q000126",
        "Q000125",
        "Q000128"
      ]
    },
    {
      "key": "red_flags",
      "title": "Alarm / red flags",
      "question_ids": [
        "Q000031",
        "Q000019",
        "Q000033",
        "Q000034",
        "Q000032",
        "Q000058",
        "Q000077"
      ]
    },
    {
      "key": "background",
      "title": "PMH / PSH / meds / allergies / FH / SH",
      "question_ids": [
        "Q000078",
        "Q000079",
        "Q000080",
        "Q000081",
        "Q000082",
        "Q000083",
        "Q000084",
        "Q000085",
        "Q000086",
        "Q000087",
        "Q000088",
        "Q000089",
        "Q000090"
      ]
    }
  ],
  "associated_complaint_codes": [
    "CC_dysphagia",
    "CC_chest_pain",
    "CC_abdominal_pain"
  ],
  "schema_version": 1,
  "revision": 3,
  "status": "active"
}
