{
  "id": "HT_pruritus",
  "complaint_code": "CC_pruritus",
  "name": "Itching (pruritus) history",
  "synonyms": [
    "Itching",
    "Generalized itch",
    "Pruritus",
    "Itchy skin"
  ],
  "body_system": "skin",
  "source": {
    "work": "Bates' Guide to Physical Examination and History Taking",
    "note": "Structure for history-taking only; not for disease extraction."
  },
  "red_flag_question_ids": [
    "Q000026",
    "Q000019",
    "Q000170"
  ],
  "sections": [
    {
      "key": "hpi_core",
      "title": "HPI — core characteristics",
      "question_ids": [
        "Q000001",
        "Q000002",
        "Q000003",
        "Q000004",
        "Q000005",
        "Q000006",
        "Q000007",
        "Q000008",
        "Q000029"
      ]
    },
    {
      "key": "associated",
      "title": "Associated symptoms",
      "question_ids": [
        "Q000026",
        "Q000027",
        "Q000028",
        "Q000180",
        "Q000166"
      ]
    },
    {
      "key": "red_flags",
      "title": "Alarm / red flags",
      "question_ids": [
        "Q000026",
        "Q000019",
        "Q000170"
      ]
    },
    {
      "key": "risk_context",
      "title": "Risk factors & exposures",
      "question_ids": [
        "Q000063"
      ]
    },
    {
      "key": "background",
      "title": "PMH / PSH / meds / allergies / FH / SH",
      "question_ids": [
        "Q000078",
        "Q000079",
        "Q000080",
        "Q000081",
        "Q000082",
        "Q000083",
        "Q000084",
        "Q000085",
        "Q000086",
        "Q000087",
        "Q000088",
        "Q000089",
        "Q000090"
      ]
    }
  ],
  "associated_complaint_codes": [
    "CC_jaundice",
    "CC_fatigue"
  ],
  "schema_version": 1,
  "revision": 1,
  "status": "active"
}
