{
  "id": "HT_abdominal_pain",
  "complaint_code": "CC_abdominal_pain",
  "name": "Abdominal pain history",
  "synonyms": [
    "Belly pain",
    "Stomach pain",
    "Abdominal discomfort",
    "Epigastric pain",
    "Flank pain if abdominal/side",
    "Colicky abdominal pain"
  ],
  "body_system": "abdomen",
  "source": {
    "work": "Bates' Guide to Physical Examination and History Taking",
    "note": "Structure for history-taking only; not for disease extraction."
  },
  "red_flag_question_ids": [
    "Q000033",
    "Q000034",
    "Q000035",
    "Q000045",
    "Q000073",
    "Q000074",
    "Q000076",
    "Q000077"
  ],
  "sections": [
    {
      "key": "hpi_core",
      "title": "HPI — core characteristics",
      "question_ids": [
        "Q000001",
        "Q000002",
        "Q000003",
        "Q000004",
        "Q000005",
        "Q000006",
        "Q000007",
        "Q000008",
        "Q000009",
        "Q000010",
        "Q000011",
        "Q000012",
        "Q000013",
        "Q000014",
        "Q000015",
        "Q000016",
        "Q000042",
        "Q000043",
        "Q000044",
        "Q000102",
        "Q000103",
        "Q000104",
        "Q000106"
      ]
    },
    {
      "key": "associated",
      "title": "Associated symptoms",
      "question_ids": [
        "Q000021",
        "Q000022",
        "Q000023",
        "Q000024",
        "Q000025",
        "Q000017",
        "Q000020",
        "Q000026",
        "Q000041",
        "Q000036",
        "Q000037",
        "Q000038",
        "Q000105",
        "Q000124",
        "Q000125",
        "Q000129",
        "Q000142",
        "Q000164",
        "Q000141",
        "Q000178",
        "Q000128"
      ]
    },
    {
      "key": "red_flags",
      "title": "Alarm / red flags",
      "question_ids": [
        "Q000033",
        "Q000034",
        "Q000035",
        "Q000045",
        "Q000073",
        "Q000074",
        "Q000075",
        "Q000076",
        "Q000019",
        "Q000077"
      ]
    },
    {
      "key": "risk_context",
      "title": "Risk factors & exposures",
      "question_ids": [
        "Q000053",
        "Q000052"
      ]
    },
    {
      "key": "background",
      "title": "PMH / PSH / meds / allergies / FH / SH",
      "question_ids": [
        "Q000078",
        "Q000079",
        "Q000080",
        "Q000081",
        "Q000082",
        "Q000083",
        "Q000084",
        "Q000085",
        "Q000086",
        "Q000087",
        "Q000088",
        "Q000089",
        "Q000090"
      ]
    }
  ],
  "associated_complaint_codes": [
    "CC_vomiting",
    "CC_diarrhea",
    "CC_constipation",
    "CC_jaundice",
    "CC_abdominal_distention",
    "CC_hematemesis",
    "CC_melena",
    "CC_hematochezia"
  ],
  "schema_version": 1,
  "revision": 4,
  "status": "active"
}
