{
  "id": "HT_constipation",
  "complaint_code": "CC_constipation",
  "name": "Constipation history",
  "synonyms": [
    "Infrequent stools",
    "Hard stools",
    "Straining",
    "Incomplete evacuation",
    "Change in bowel habits toward harder/less frequent stools"
  ],
  "body_system": "abdomen",
  "source": {
    "work": "Bates' Guide to Physical Examination and History Taking",
    "note": "Structure for history-taking only; not for disease extraction."
  },
  "red_flag_question_ids": [
    "Q000045",
    "Q000035",
    "Q000019",
    "Q000073"
  ],
  "sections": [
    {
      "key": "hpi_core",
      "title": "HPI — core characteristics",
      "question_ids": [
        "Q000001",
        "Q000002",
        "Q000003",
        "Q000004",
        "Q000005",
        "Q000006",
        "Q000007",
        "Q000008",
        "Q000009",
        "Q000010",
        "Q000011",
        "Q000012",
        "Q000013",
        "Q000014",
        "Q000015",
        "Q000016",
        "Q000047",
        "Q000048",
        "Q000129",
        "Q000132",
        "Q000133",
        "Q000131"
      ]
    },
    {
      "key": "associated",
      "title": "Associated symptoms",
      "question_ids": [
        "Q000042",
        "Q000025",
        "Q000021",
        "Q000022",
        "Q000020",
        "Q000092",
        "Q000134",
        "Q000137",
        "Q000045"
      ]
    },
    {
      "key": "red_flags",
      "title": "Alarm / red flags",
      "question_ids": [
        "Q000045",
        "Q000035",
        "Q000019",
        "Q000073",
        "Q000091"
      ]
    },
    {
      "key": "background",
      "title": "PMH / PSH / meds / allergies / FH / SH",
      "question_ids": [
        "Q000078",
        "Q000079",
        "Q000080",
        "Q000081",
        "Q000082",
        "Q000083",
        "Q000084",
        "Q000085",
        "Q000086",
        "Q000087",
        "Q000088",
        "Q000089",
        "Q000090"
      ]
    }
  ],
  "associated_complaint_codes": [
    "CC_abdominal_pain",
    "CC_vomiting"
  ],
  "schema_version": 1,
  "revision": 2,
  "status": "active"
}
