{
  "id": "HT_back_pain",
  "complaint_code": "CC_back_pain",
  "name": "Back pain history",
  "synonyms": [
    "Back pain",
    "Low back pain",
    "Thoracolumbar pain",
    "Neck pain with back"
  ],
  "body_system": "musculoskeletal",
  "source": {
    "work": "Bates' Guide to Physical Examination and History Taking",
    "note": "Structure for history-taking only; not for disease extraction."
  },
  "red_flag_question_ids": [
    "Q000037",
    "Q000167",
    "Q000176"
  ],
  "sections": [
    {
      "key": "hpi_core",
      "title": "HPI — core characteristics",
      "question_ids": [
        "Q000001",
        "Q000002",
        "Q000003",
        "Q000004",
        "Q000005",
        "Q000006",
        "Q000007",
        "Q000008",
        "Q000009",
        "Q000010",
        "Q000011",
        "Q000012",
        "Q000013",
        "Q000014",
        "Q000015",
        "Q000016",
        "Q000178"
      ]
    },
    {
      "key": "associated",
      "title": "Associated symptoms",
      "question_ids": [
        "Q000042",
        "Q000164",
        "Q000036",
        "Q000167",
        "Q000177",
        "Q000156",
        "Q000179"
      ]
    },
    {
      "key": "red_flags",
      "title": "Alarm / red flags",
      "question_ids": [
        "Q000037",
        "Q000176",
        "Q000069"
      ]
    },
    {
      "key": "risk_context",
      "title": "Risk factors & exposures",
      "question_ids": []
    },
    {
      "key": "background",
      "title": "PMH / PSH / meds / allergies / FH / SH",
      "question_ids": [
        "Q000078",
        "Q000079",
        "Q000080",
        "Q000081",
        "Q000082",
        "Q000083",
        "Q000084",
        "Q000085",
        "Q000086",
        "Q000087",
        "Q000088",
        "Q000089",
        "Q000090"
      ]
    }
  ],
  "associated_complaint_codes": [
    "CC_abdominal_pain",
    "CC_flank_pain",
    "CC_chest_pain"
  ],
  "schema_version": 1,
  "revision": 2,
  "status": "active"
}
