{
  "id": "HT_melena",
  "complaint_code": "CC_melena",
  "name": "Black tarry stools (melena) history",
  "synonyms": [
    "Black stools",
    "Tarry stools",
    "Black sticky stools",
    "Melena"
  ],
  "body_system": "abdomen",
  "source": {
    "work": "Bates' Guide to Physical Examination and History Taking",
    "note": "Structure for history-taking only; not for disease extraction."
  },
  "red_flag_question_ids": [
    "Q000033",
    "Q000038",
    "Q000035",
    "Q000075",
    "Q000077"
  ],
  "sections": [
    {
      "key": "hpi_core",
      "title": "HPI — core characteristics",
      "question_ids": [
        "Q000001",
        "Q000002",
        "Q000003",
        "Q000004",
        "Q000005",
        "Q000112",
        "Q000094",
        "Q000095",
        "Q000047",
        "Q000048"
      ]
    },
    {
      "key": "associated",
      "title": "Associated symptoms",
      "question_ids": [
        "Q000033",
        "Q000035",
        "Q000021",
        "Q000022",
        "Q000042",
        "Q000038",
        "Q000019",
        "Q000020",
        "Q000017"
      ]
    },
    {
      "key": "red_flags",
      "title": "Alarm / red flags",
      "question_ids": [
        "Q000033",
        "Q000038",
        "Q000035",
        "Q000075",
        "Q000019",
        "Q000077"
      ]
    },
    {
      "key": "risk_context",
      "title": "Risk factors & exposures",
      "question_ids": [
        "Q000111",
        "Q000096",
        "Q000098",
        "Q000053"
      ]
    },
    {
      "key": "background",
      "title": "PMH / PSH / meds / allergies / FH / SH",
      "question_ids": [
        "Q000078",
        "Q000079",
        "Q000080",
        "Q000081",
        "Q000082",
        "Q000083",
        "Q000084",
        "Q000085",
        "Q000086",
        "Q000087",
        "Q000088",
        "Q000089",
        "Q000090"
      ]
    }
  ],
  "associated_complaint_codes": [
    "CC_hematemesis",
    "CC_hematochezia",
    "CC_abdominal_pain",
    "CC_vomiting"
  ],
  "schema_version": 1,
  "revision": 3,
  "status": "active"
}
