{
  "id": "HT_fever",
  "complaint_code": "CC_fever",
  "name": "Fever history",
  "synonyms": [
    "Pyrexia",
    "Feeling feverish",
    "Chills",
    "Night sweats",
    "Rigors"
  ],
  "body_system": "general",
  "source": {
    "work": "Bates' Guide to Physical Examination and History Taking",
    "note": "Structure for history-taking only; not for disease extraction."
  },
  "red_flag_question_ids": [
    "Q000074",
    "Q000073",
    "Q000037",
    "Q000075"
  ],
  "sections": [
    {
      "key": "hpi_core",
      "title": "HPI — core characteristics",
      "question_ids": [
        "Q000001",
        "Q000002",
        "Q000003",
        "Q000004",
        "Q000005",
        "Q000006",
        "Q000007",
        "Q000008",
        "Q000009",
        "Q000010",
        "Q000011",
        "Q000012",
        "Q000013",
        "Q000014",
        "Q000015",
        "Q000016"
      ]
    },
    {
      "key": "associated",
      "title": "Associated symptoms",
      "question_ids": [
        "Q000018",
        "Q000039",
        "Q000040",
        "Q000021",
        "Q000022",
        "Q000023",
        "Q000041",
        "Q000042",
        "Q000037",
        "Q000166",
        "Q000168",
        "Q000184",
        "Q000179",
        "Q000181"
      ]
    },
    {
      "key": "red_flags",
      "title": "Alarm / red flags",
      "question_ids": [
        "Q000074",
        "Q000073",
        "Q000037",
        "Q000075"
      ]
    },
    {
      "key": "risk_context",
      "title": "Risk factors & exposures",
      "question_ids": [
        "Q000053",
        "Q000052"
      ]
    },
    {
      "key": "background",
      "title": "PMH / PSH / meds / allergies / FH / SH",
      "question_ids": [
        "Q000078",
        "Q000079",
        "Q000080",
        "Q000081",
        "Q000082",
        "Q000083",
        "Q000084",
        "Q000085",
        "Q000086",
        "Q000087",
        "Q000088",
        "Q000089",
        "Q000090"
      ]
    }
  ],
  "associated_complaint_codes": [
    "CC_cough",
    "CC_abdominal_pain",
    "CC_dysuria"
  ],
  "schema_version": 1,
  "revision": 3,
  "status": "active"
}
