{
  "id": "HT_edema",
  "complaint_code": "CC_edema",
  "name": "Leg / body swelling (edema) history",
  "synonyms": [
    "Leg swelling",
    "Ankle swelling",
    "Edema",
    "Peripheral swelling",
    "Puffy legs"
  ],
  "body_system": "cardiovascular",
  "source": {
    "work": "Bates' Guide to Physical Examination and History Taking",
    "note": "Structure for history-taking only; not for disease extraction."
  },
  "red_flag_question_ids": [
    "Q000037",
    "Q000144",
    "Q000046"
  ],
  "sections": [
    {
      "key": "hpi_core",
      "title": "HPI — core characteristics",
      "question_ids": [
        "Q000001",
        "Q000002",
        "Q000003",
        "Q000004",
        "Q000005",
        "Q000006",
        "Q000007",
        "Q000008",
        "Q000072",
        "Q000118"
      ]
    },
    {
      "key": "associated",
      "title": "Associated symptoms",
      "question_ids": [
        "Q000037",
        "Q000144",
        "Q000145",
        "Q000046",
        "Q000026",
        "Q000169",
        "Q000156",
        "Q000157"
      ]
    },
    {
      "key": "red_flags",
      "title": "Alarm / red flags",
      "question_ids": [
        "Q000037",
        "Q000144",
        "Q000145"
      ]
    },
    {
      "key": "risk_context",
      "title": "Risk factors & exposures",
      "question_ids": []
    },
    {
      "key": "background",
      "title": "PMH / PSH / meds / allergies / FH / SH",
      "question_ids": [
        "Q000078",
        "Q000079",
        "Q000080",
        "Q000081",
        "Q000082",
        "Q000083",
        "Q000084",
        "Q000085",
        "Q000086",
        "Q000087",
        "Q000088",
        "Q000089",
        "Q000090"
      ]
    }
  ],
  "associated_complaint_codes": [
    "CC_dyspnea",
    "CC_abdominal_distention",
    "CC_weight_gain"
  ],
  "schema_version": 1,
  "revision": 2,
  "status": "active"
}
