{
  "id": "HT_anorexia",
  "complaint_code": "CC_anorexia",
  "name": "Loss of appetite / early satiety history",
  "synonyms": [
    "Anorexia",
    "Loss of appetite",
    "Early satiety",
    "Postprandial fullness",
    "Poor appetite",
    "Food fear"
  ],
  "body_system": "abdomen",
  "source": {
    "work": "Bates' Guide to Physical Examination and History Taking",
    "note": "Structure for history-taking only; not for disease extraction."
  },
  "red_flag_question_ids": [
    "Q000019",
    "Q000033",
    "Q000034",
    "Q000124"
  ],
  "sections": [
    {
      "key": "hpi_core",
      "title": "HPI — core characteristics",
      "question_ids": [
        "Q000001",
        "Q000002",
        "Q000003",
        "Q000004",
        "Q000005",
        "Q000006",
        "Q000007",
        "Q000008",
        "Q000009",
        "Q000010",
        "Q000011",
        "Q000012",
        "Q000013",
        "Q000014",
        "Q000015",
        "Q000016",
        "Q000020",
        "Q000124",
        "Q000125",
        "Q000142"
      ]
    },
    {
      "key": "associated",
      "title": "Associated symptoms",
      "question_ids": [
        "Q000021",
        "Q000022",
        "Q000042",
        "Q000030",
        "Q000026",
        "Q000166",
        "Q000171"
      ]
    },
    {
      "key": "red_flags",
      "title": "Alarm / red flags",
      "question_ids": [
        "Q000019",
        "Q000033",
        "Q000034",
        "Q000035",
        "Q000031"
      ]
    },
    {
      "key": "risk_context",
      "title": "Risk factors & exposures",
      "question_ids": [
        "Q000053"
      ]
    },
    {
      "key": "background",
      "title": "PMH / PSH / meds / allergies / FH / SH",
      "question_ids": [
        "Q000078",
        "Q000079",
        "Q000080",
        "Q000081",
        "Q000082",
        "Q000083",
        "Q000084",
        "Q000085",
        "Q000086",
        "Q000087",
        "Q000088",
        "Q000089",
        "Q000090"
      ]
    }
  ],
  "associated_complaint_codes": [
    "CC_weight_loss",
    "CC_vomiting",
    "CC_abdominal_pain",
    "CC_jaundice"
  ],
  "schema_version": 1,
  "revision": 1,
  "status": "active"
}
