{
  "id": "HT_dizziness",
  "complaint_code": "CC_dizziness",
  "name": "Dizziness / vertigo / lightheadedness history",
  "synonyms": [
    "Dizziness",
    "Lightheadedness",
    "Vertigo",
    "Unsteadiness",
    "Near-fainting"
  ],
  "body_system": "neurologic",
  "source": {
    "work": "Bates' Guide to Physical Examination and History Taking",
    "note": "Structure for history-taking only; not for disease extraction."
  },
  "red_flag_question_ids": [
    "Q000153",
    "Q000175",
    "Q000176"
  ],
  "sections": [
    {
      "key": "hpi_core",
      "title": "HPI — core characteristics",
      "question_ids": [
        "Q000001",
        "Q000002",
        "Q000003",
        "Q000004",
        "Q000005",
        "Q000006",
        "Q000007",
        "Q000008",
        "Q000154",
        "Q000038"
      ]
    },
    {
      "key": "associated",
      "title": "Associated symptoms",
      "question_ids": [
        "Q000036",
        "Q000037",
        "Q000174",
        "Q000033",
        "Q000034",
        "Q000152"
      ]
    },
    {
      "key": "red_flags",
      "title": "Alarm / red flags",
      "question_ids": [
        "Q000153",
        "Q000175",
        "Q000176"
      ]
    },
    {
      "key": "risk_context",
      "title": "Risk factors & exposures",
      "question_ids": []
    },
    {
      "key": "background",
      "title": "PMH / PSH / meds / allergies / FH / SH",
      "question_ids": [
        "Q000078",
        "Q000079",
        "Q000080",
        "Q000081",
        "Q000082",
        "Q000083",
        "Q000084",
        "Q000085",
        "Q000086",
        "Q000087",
        "Q000088",
        "Q000089",
        "Q000090"
      ]
    }
  ],
  "associated_complaint_codes": [
    "CC_syncope",
    "CC_headache",
    "CC_hematemesis"
  ],
  "schema_version": 1,
  "revision": 1,
  "status": "active"
}
