{
  "id": "HT_fecal_incontinence",
  "complaint_code": "CC_fecal_incontinence",
  "name": "Fecal incontinence history",
  "synonyms": [
    "Stool leakage",
    "Accidental bowel leakage",
    "Soiling",
    "Loss of bowel control"
  ],
  "body_system": "abdomen",
  "source": {
    "work": "Bates' Guide to Physical Examination and History Taking",
    "note": "Structure for history-taking only; not for disease extraction."
  },
  "red_flag_question_ids": [
    "Q000035",
    "Q000019",
    "Q000176"
  ],
  "sections": [
    {
      "key": "hpi_core",
      "title": "HPI — core characteristics",
      "question_ids": [
        "Q000001",
        "Q000002",
        "Q000003",
        "Q000004",
        "Q000005",
        "Q000006",
        "Q000007",
        "Q000008",
        "Q000134",
        "Q000047",
        "Q000048",
        "Q000050",
        "Q000129"
      ]
    },
    {
      "key": "associated",
      "title": "Associated symptoms",
      "question_ids": [
        "Q000023",
        "Q000024",
        "Q000163",
        "Q000137",
        "Q000166"
      ]
    },
    {
      "key": "red_flags",
      "title": "Alarm / red flags",
      "question_ids": [
        "Q000035",
        "Q000019",
        "Q000176"
      ]
    },
    {
      "key": "risk_context",
      "title": "Risk factors & exposures",
      "question_ids": []
    },
    {
      "key": "background",
      "title": "PMH / PSH / meds / allergies / FH / SH",
      "question_ids": [
        "Q000078",
        "Q000079",
        "Q000080",
        "Q000081",
        "Q000082",
        "Q000083",
        "Q000084",
        "Q000085",
        "Q000086",
        "Q000087",
        "Q000088",
        "Q000089",
        "Q000090"
      ]
    }
  ],
  "associated_complaint_codes": [
    "CC_diarrhea",
    "CC_constipation",
    "CC_anal_pain"
  ],
  "schema_version": 1,
  "revision": 1,
  "status": "active"
}
