{
  "id": "HT_weight_loss",
  "complaint_code": "CC_weight_loss",
  "name": "Unintentional weight loss history",
  "synonyms": [
    "Unintentional weight loss",
    "Losing weight without trying",
    "Reduced oral intake with weight loss"
  ],
  "body_system": "general",
  "source": {
    "work": "Bates' Guide to Physical Examination and History Taking",
    "note": "Structure for history-taking only; not for disease extraction."
  },
  "red_flag_question_ids": [
    "Q000031",
    "Q000033",
    "Q000034",
    "Q000035",
    "Q000026"
  ],
  "sections": [
    {
      "key": "hpi_core",
      "title": "HPI — core characteristics",
      "question_ids": [
        "Q000001",
        "Q000002",
        "Q000003",
        "Q000004",
        "Q000005",
        "Q000006",
        "Q000007",
        "Q000008",
        "Q000009",
        "Q000010",
        "Q000011",
        "Q000012",
        "Q000013",
        "Q000014",
        "Q000015",
        "Q000016",
        "Q000020",
        "Q000092"
      ]
    },
    {
      "key": "associated",
      "title": "Associated symptoms",
      "question_ids": [
        "Q000017",
        "Q000018",
        "Q000023",
        "Q000031",
        "Q000021",
        "Q000022",
        "Q000026",
        "Q000091",
        "Q000124",
        "Q000020",
        "Q000171",
        "Q000166",
        "Q000172"
      ]
    },
    {
      "key": "red_flags",
      "title": "Alarm / red flags",
      "question_ids": [
        "Q000031",
        "Q000033",
        "Q000034",
        "Q000035",
        "Q000026"
      ]
    },
    {
      "key": "background",
      "title": "PMH / PSH / meds / allergies / FH / SH",
      "question_ids": [
        "Q000078",
        "Q000079",
        "Q000080",
        "Q000081",
        "Q000082",
        "Q000083",
        "Q000084",
        "Q000085",
        "Q000086",
        "Q000087",
        "Q000088",
        "Q000089",
        "Q000090"
      ]
    }
  ],
  "associated_complaint_codes": [
    "CC_anorexia",
    "CC_diarrhea",
    "CC_dysphagia",
    "CC_jaundice"
  ],
  "schema_version": 1,
  "revision": 3,
  "status": "active"
}
