{
  "id": "HT_hematuria",
  "complaint_code": "CC_hematuria",
  "name": "Blood in urine (hematuria) history",
  "synonyms": [
    "Hematuria",
    "Blood in urine",
    "Red urine",
    "Pink urine"
  ],
  "body_system": "urinary",
  "source": {
    "work": "Bates' Guide to Physical Examination and History Taking",
    "note": "Structure for history-taking only; not for disease extraction."
  },
  "red_flag_question_ids": [
    "Q000162",
    "Q000038",
    "Q000017"
  ],
  "sections": [
    {
      "key": "hpi_core",
      "title": "HPI — core characteristics",
      "question_ids": [
        "Q000001",
        "Q000002",
        "Q000003",
        "Q000004",
        "Q000005",
        "Q000006",
        "Q000007",
        "Q000008",
        "Q000162",
        "Q000165"
      ]
    },
    {
      "key": "associated",
      "title": "Associated symptoms",
      "question_ids": [
        "Q000158",
        "Q000159",
        "Q000164",
        "Q000034",
        "Q000035",
        "Q000019"
      ]
    },
    {
      "key": "red_flags",
      "title": "Alarm / red flags",
      "question_ids": [
        "Q000038",
        "Q000017",
        "Q000019"
      ]
    },
    {
      "key": "risk_context",
      "title": "Risk factors & exposures",
      "question_ids": []
    },
    {
      "key": "background",
      "title": "PMH / PSH / meds / allergies / FH / SH",
      "question_ids": [
        "Q000078",
        "Q000079",
        "Q000080",
        "Q000081",
        "Q000082",
        "Q000083",
        "Q000084",
        "Q000085",
        "Q000086",
        "Q000087",
        "Q000088",
        "Q000089",
        "Q000090"
      ]
    }
  ],
  "associated_complaint_codes": [
    "CC_dysuria",
    "CC_flank_pain",
    "CC_abdominal_pain"
  ],
  "schema_version": 1,
  "revision": 1,
  "status": "active"
}
