{
  "id": "HT_dysuria",
  "complaint_code": "CC_dysuria",
  "name": "Painful / difficult urination history",
  "synonyms": [
    "Dysuria",
    "Burning urination",
    "Urinary frequency",
    "Urinary urgency",
    "Hesitancy",
    "Weak stream",
    "Incomplete bladder emptying",
    "Urinary retention sensation"
  ],
  "body_system": "urinary",
  "source": {
    "work": "Bates' Guide to Physical Examination and History Taking",
    "note": "Structure for history-taking only; not for disease extraction."
  },
  "red_flag_question_ids": [
    "Q000162",
    "Q000017",
    "Q000164"
  ],
  "sections": [
    {
      "key": "hpi_core",
      "title": "HPI — core characteristics",
      "question_ids": [
        "Q000001",
        "Q000002",
        "Q000003",
        "Q000004",
        "Q000005",
        "Q000006",
        "Q000007",
        "Q000008",
        "Q000158",
        "Q000159",
        "Q000160",
        "Q000161"
      ]
    },
    {
      "key": "associated",
      "title": "Associated symptoms",
      "question_ids": [
        "Q000162",
        "Q000165",
        "Q000163",
        "Q000164",
        "Q000017",
        "Q000172"
      ]
    },
    {
      "key": "red_flags",
      "title": "Alarm / red flags",
      "question_ids": [
        "Q000162",
        "Q000017",
        "Q000164"
      ]
    },
    {
      "key": "risk_context",
      "title": "Risk factors & exposures",
      "question_ids": []
    },
    {
      "key": "background",
      "title": "PMH / PSH / meds / allergies / FH / SH",
      "question_ids": [
        "Q000078",
        "Q000079",
        "Q000080",
        "Q000081",
        "Q000082",
        "Q000083",
        "Q000084",
        "Q000085",
        "Q000086",
        "Q000087",
        "Q000088",
        "Q000089",
        "Q000090"
      ]
    }
  ],
  "associated_complaint_codes": [
    "CC_hematuria",
    "CC_flank_pain",
    "CC_fever"
  ],
  "schema_version": 1,
  "revision": 2,
  "status": "active"
}
