{
  "id": "HT_hemoptysis",
  "complaint_code": "CC_hemoptysis",
  "name": "Coughing blood (hemoptysis) history",
  "synonyms": [
    "Hemoptysis",
    "Coughing blood",
    "Blood in sputum",
    "Bloody spit from chest"
  ],
  "body_system": "respiratory",
  "source": {
    "work": "Bates' Guide to Physical Examination and History Taking",
    "note": "Structure for history-taking only; not for disease extraction."
  },
  "red_flag_question_ids": [
    "Q000107",
    "Q000037",
    "Q000038"
  ],
  "sections": [
    {
      "key": "hpi_core",
      "title": "HPI — core characteristics",
      "question_ids": [
        "Q000001",
        "Q000002",
        "Q000003",
        "Q000004",
        "Q000005",
        "Q000006",
        "Q000007",
        "Q000008",
        "Q000107",
        "Q000146",
        "Q000148",
        "Q000109",
        "Q000095"
      ]
    },
    {
      "key": "associated",
      "title": "Associated symptoms",
      "question_ids": [
        "Q000147",
        "Q000037",
        "Q000036",
        "Q000017",
        "Q000033",
        "Q000157",
        "Q000181"
      ]
    },
    {
      "key": "red_flags",
      "title": "Alarm / red flags",
      "question_ids": [
        "Q000107",
        "Q000038",
        "Q000037",
        "Q000069"
      ]
    },
    {
      "key": "risk_context",
      "title": "Risk factors & exposures",
      "question_ids": []
    },
    {
      "key": "background",
      "title": "PMH / PSH / meds / allergies / FH / SH",
      "question_ids": [
        "Q000078",
        "Q000079",
        "Q000080",
        "Q000081",
        "Q000082",
        "Q000083",
        "Q000084",
        "Q000085",
        "Q000086",
        "Q000087",
        "Q000088",
        "Q000089",
        "Q000090"
      ]
    }
  ],
  "associated_complaint_codes": [
    "CC_cough",
    "CC_dyspnea",
    "CC_chest_pain",
    "CC_hematemesis"
  ],
  "schema_version": 1,
  "revision": 2,
  "status": "active"
}
